{
  "source_type": "resume",
  "source_file": "Karthik Subramaniam.docx",
  "cv_file": "Karthik Subramaniam.docx",
  "name": "Karthik Subramaniam",
  "email": "",
  "education": [
    "B.Tech, Computer Science and Engineering, Class of 2026 \u2014 CGPA 8.2 / 10"
  ],
  "projects": [
    "Built an end-to-end churn-prediction pipeline (SQL extraction \u2192 feature engineering \u2192 logistic regression model) on a public e-commerce dataset",
    "Designed a normalized schema and dashboard for a college event-management system, including anomaly detection on registration spikes",
    "Ran and analyzed an A/B test simulation comparing two onboarding flows, presenting results to a non-technical audience"
  ],
  "hackathons": [
    "Runner-up, inter-college data visualization competition"
  ],
  "internships": [
    "Data Analytics intern at a fintech startup \u2014 built two recurring dashboards used by the growth team"
  ],
  "certifications": [
    "Google Data Analytics Certificate"
  ],
  "achievements": [
    "Published a short analysis write-up on a public dataset, featured in a college newsletter"
  ],
  "preferred_roles": [
    "Data Analyst",
    "Data Scientist"
  ],
  "skills": [
    {
      "skill_name": "Python",
      "category_code": "COD",
      "evidence": "### Technical Skills SQL, Python (pandas, scikit-learn), Power...",
      "confidence": "high"
    },
    {
      "skill_name": "Java",
      "category_code": "COD",
      "evidence": "...testing basics, Excel, basic Java  ### Projects Built an end-to...",
      "confidence": "high"
    },
    {
      "skill_name": "Statistics",
      "category_code": "APTI",
      "evidence": "...das, scikit-learn), Power BI, Statistics, A/B testing basics, Excel, b...",
      "confidence": "high"
    },
    {
      "skill_name": "A/B Testing",
      "category_code": "APTI",
      "evidence": "...learn), Power BI, Statistics, A/B testing basics, Excel, basic Java  ##...",
      "confidence": "high"
    },
    {
      "skill_name": "Stakeholder Presentation",
      "category_code": "COMM",
      "evidence": "...mparing two onboarding flows, presenting results to a non-technical au...",
      "confidence": "high"
    },
    {
      "skill_name": "scikit-learn",
      "category_code": "AI",
      "evidence": "...l Skills SQL, Python (pandas, scikit-learn), Power BI, Statistics, A/B t...",
      "confidence": "high"
    },
    {
      "skill_name": "pandas",
      "category_code": "AI",
      "evidence": "...Technical Skills SQL, Python (pandas, scikit-learn), Power BI, Sta...",
      "confidence": "high"
    },
    {
      "skill_name": "Predictive Modeling",
      "category_code": "AI",
      "evidence": "...ction \u2192 feature engineering \u2192 logistic regression model) on a public e-commerce...",
      "confidence": "high"
    },
    {
      "skill_name": "SQL",
      "category_code": "SQL",
      "evidence": "### Technical Skills SQL, Python (pandas, scikit-learn...",
      "confidence": "high"
    },
    {
      "skill_name": "Software Testing",
      "category_code": "SWE",
      "evidence": "...n), Power BI, Statistics, A/B testing basics, Excel, basic Java  ##...",
      "confidence": "high"
    },
    {
      "skill_name": "MS Excel",
      "category_code": "OTHER",
      "evidence": "...atistics, A/B testing basics, Excel, basic Java  ### Projects Bui...",
      "confidence": "high"
    },
    {
      "skill_name": "Power BI",
      "category_code": "OTHER",
      "evidence": "...ython (pandas, scikit-learn), Power BI, Statistics, A/B testing basi...",
      "confidence": "high"
    }
  ],
  "extraction_mode": "offline_heuristic"
}