{
  "source_type": "resume",
  "source_file": "Ananya Rao.pdf",
  "cv_file": "Ananya Rao.pdf",
  "name": "Ananya Rao",
  "email": "",
  "education": [
    "B.Tech, Computer Science and Engineering, Class of 2026 \u2014 CGPA 8.6 / 10"
  ],
  "projects": [
    "Built a distributed URL-shortening service with a Redis-backed cache and a",
    "horizontally-scalable API layer as a capstone systems project",
    "Implemented a multithreaded job scheduler in C++ simulating OS-level process",
    "scheduling algorithms (Round Robin, Priority, SJF)",
    "Designed a parking-lot management system in Java using OOP design patterns",
    "(Factory, Strategy) as a design-practice exercise"
  ],
  "hackathons": [
    "Finalist, national-level 24-hour hackathon \u2014 built a real-time chat backend",
    "used in production"
  ],
  "internships": [
    "Summer intern, backend team at a mid-size product startup \u2014 shipped a rate-limiter"
  ],
  "certifications": [],
  "achievements": [
    "Solved 350+ problems on competitive programming platforms; mentors juniors on DSA",
    "through the college coding club"
  ],
  "preferred_roles": [
    "Software Engineer",
    "Backend Engineer"
  ],
  "skills": [
    {
      "skill_name": "Python",
      "category_code": "COD",
      "evidence": "### Technical Skills C++, Python, Java, Data Structures & Algo...",
      "confidence": "high"
    },
    {
      "skill_name": "Java",
      "category_code": "COD",
      "evidence": "...Technical Skills C++, Python, Java, Data Structures & Algorithms...",
      "confidence": "high"
    },
    {
      "skill_name": "Data Structures",
      "category_code": "DSA",
      "evidence": "...cal Skills C++, Python, Java, Data Structures & Algorithms, Operating Syste...",
      "confidence": "high"
    },
    {
      "skill_name": "Algorithms",
      "category_code": "DSA",
      "evidence": "...thon, Java, Data Structures & Algorithms, Operating Systems, Computer...",
      "confidence": "high"
    },
    {
      "skill_name": "Competitive Programming",
      "category_code": "DSA",
      "evidence": "...ments Solved 350+ problems on competitive programming platforms; mentors juniors on...",
      "confidence": "high"
    },
    {
      "skill_name": "Scheduling Algorithms",
      "category_code": "DSA",
      "evidence": "...rocess scheduling algorithms (Round Robin, Priority, SJF) \u2022 Designed a...",
      "confidence": "medium"
    },
    {
      "skill_name": "Object-Oriented Design",
      "category_code": "OOD",
      "evidence": "...g Systems, Computer Networks, Object-Oriented Design, Git, Linux  ### Projects \u2022 B...",
      "confidence": "high"
    },
    {
      "skill_name": "Design Patterns",
      "category_code": "OOD",
      "evidence": "...ment system in Java using OOP design patterns (Factory, Strategy) as a desi...",
      "confidence": "high"
    },
    {
      "skill_name": "Design Patterns (GoF)",
      "category_code": "OOD",
      "evidence": "...va using OOP design patterns (Factory, Strategy) as a design-practi...",
      "confidence": "high"
    },
    {
      "skill_name": "Mentorship",
      "category_code": "COMM",
      "evidence": "...titive programming platforms; mentors juniors on DSA through the college co...",
      "confidence": "high"
    },
    {
      "skill_name": "Git",
      "category_code": "SWE",
      "evidence": "...orks, Object-Oriented Design, Git, Linux  ### Projects \u2022 Built...",
      "confidence": "high"
    },
    {
      "skill_name": "Redis",
      "category_code": "SYSD",
      "evidence": "...URL-shortening service with a Redis-backed cache and a horizontal...",
      "confidence": "high"
    },
    {
      "skill_name": "Distributed Systems",
      "category_code": "SYSD",
      "evidence": "...Linux  ### Projects \u2022 Built a distributed URL-shortening service with a...",
      "confidence": "high"
    },
    {
      "skill_name": "Rate Limiting Architecture",
      "category_code": "SYSD",
      "evidence": "...e product startup \u2014 shipped a rate-limiter used in production  ### Achie...",
      "confidence": "high"
    },
    {
      "skill_name": "Computer Networks",
      "category_code": "NETW",
      "evidence": "...lgorithms, Operating Systems, Computer Networks, Object-Oriented Design, Git,...",
      "confidence": "high"
    },
    {
      "skill_name": "Network Protocols & APIs",
      "category_code": "NETW",
      "evidence": "...e and a horizontally-scalable API layer as a capstone systems p...",
      "confidence": "high"
    },
    {
      "skill_name": "Operating Systems",
      "category_code": "OS",
      "evidence": "...Data Structures & Algorithms, Operating Systems, Computer Networks, Object-Or...",
      "confidence": "high"
    },
    {
      "skill_name": "Linux",
      "category_code": "OS",
      "evidence": "...Object-Oriented Design, Git, Linux  ### Projects \u2022 Built a distr...",
      "confidence": "high"
    },
    {
      "skill_name": "Multithreading & Concurrency",
      "category_code": "OS",
      "evidence": "...stems project \u2022 Implemented a multithreaded job scheduler in C++ simulati...",
      "confidence": "high"
    }
  ],
  "extraction_mode": "offline_heuristic"
}